{"specversion":"1.0","id":"evt_01932f13-0cd2-7a82-8fa3-1cb5ce13ef11","source":"https://runtime.example.invalid/instances/instance-01","type":"io.arop.output.delta.v1","subject":"runs/run_01932f13-0cd2-7a82-8fa3-1cb5ce13ef10","time":"2026-09-21T08:00:01.125Z","datacontenttype":"application/json","dataschema":"https://arop.invalid/schemas/v1/events/output-events-v1.schema.json","runid":"run_01932f13-0cd2-7a82-8fa3-1cb5ce13ef10","attemptid":"att_01932f13-0cd2-7a82-8fa3-1cb5ce13ef12","producersequence":1,"traceparent":"00-4bf92f3577b34da6a3ce929d0e0e4736-00f067aa0ba902b7-01","data":{"output_id":"answer","offset":0,"delta":"商品"}}
